<?xml version="1.0"?>
<!DOCTYPE FubiRecognizers SYSTEM "FubiRecognizers.dtd">
<FubiRecognizers>
  <JointRelationRecognizer name="leftHandAboveHead" visibility="hidden">
    <Joints main="leftHand" relative="head"/>
    <MinValues y="1"/>
  </JointRelationRecognizer>
  <JointRelationRecognizer name="leftHandAboveShoulder" visibility="hidden">
    <Joints main="leftHand" relative="leftShoulder"/>
    <MinValues y="1"/>
  </JointRelationRecognizer>
  <JointRelationRecognizer name="rightHandNearHead" visibility="hidden">
    <Joints main="rightHand" relative="head"/>
    <MaxValues dist="200"/>
  </JointRelationRecognizer>
  <JointRelationRecognizer name="rightHandNearTorso" visibility="hidden">
    <Joints main="rightHand" relative="torso"/>
    <MaxValues dist="200"/>
  </JointRelationRecognizer>
  <JointRelationRecognizer name="leftHandAndLeftElbow" visibility="hidden">
    <Joints main="leftHand" relative="leftElbow"/>
    <MinValues y="0"/>
  </JointRelationRecognizer>
  
  <LinearMovementRecognizer name="leftHandMovesRight" visibility="hidden">
    <Joints main="leftHand" relative="leftShoulder"/>
    <Direction x="2" y="0" z="0"/>
    <Speed min="250"/>
  </LinearMovementRecognizer>
  <LinearMovementRecognizer name="leftHandMovesDown" visibility="hidden">
    <Joints main="leftHand" relative="leftShoulder"/>
    <Direction x="0" y="-2" z="0"/>
    <Speed min="250"/>
  </LinearMovementRecognizer>
  <LinearMovementRecognizer name="leftHandMovesLeft" visibility="hidden">
    <Joints main="leftHand" relative="leftShoulder"/>
    <Direction x="-2" y="0" z="0"/>
    <Speed min="250"/>
  </LinearMovementRecognizer>
  <LinearMovementRecognizer name="leftHandMovesUp" visibility="hidden">
    <Joints main="leftHand" relative="leftShoulder"/>
    <Direction x="0" y="2" z="0"/>
    <Speed min="250"/>
  </LinearMovementRecognizer>

  <!-- ************ -->
  <!-- Combinations -->
  <!-- ************ -->
  <!-- Left hand waving above head -->
  <CombinationRecognizer name="LeftHandWavingAboveHead">
    <State minDuration="0.1" maxDuration="1.2" timeForTransition="0.3">
      <Recognizer name="leftHandAboveHead"/>
      <Recognizer name="leftHandMovesLeft"/>
    </State>
    <State minDuration="0.1" maxDuration="1.2" timeForTransition="0.3">
      <Recognizer name="leftHandAboveHead"/>
      <Recognizer name="leftHandMovesRight"/>
    </State>
    <State minDuration="0.1" maxDuration="1.2" timeForTransition="0.3">
      <Recognizer name="leftHandAboveHead"/>
      <Recognizer name="leftHandMovesLeft"/>
    </State>
    <State minDuration="0.1">
      <Recognizer name="leftHandAboveHead"/>
      <Recognizer name="leftHandMovesRight"/>
    </State>
  </CombinationRecognizer>
  
   <!-- circle clockwise with left hand -->
  <CombinationRecognizer name="LeftHandCircleClockwise">
    <State minDuration="0.05" maxDuration="0.2" timeForTransition="0.2">
      <Recognizer name="leftHandMovesRight"/>
      <NotRecognizer name="leftHandAboveShoulder"/>
    </State>
    <State minDuration="0.05" maxDuration="0.2" timeForTransition="0.2">
      <Recognizer name="leftHandMovesDown"/>
      <NotRecognizer name="leftHandAboveShoulder"/>
    </State>
    <State minDuration="0.05" maxDuration="0.2" timeForTransition="0.2">
      <Recognizer name="leftHandMovesLeft"/>
      <NotRecognizer name="leftHandAboveShoulder"/>
    </State>
    <State minDuration="0.05" maxDuration="0.2" timeForTransition="0.2">
      <Recognizer name="leftHandMovesUp"/>
      <NotRecognizer name="leftHandAboveShoulder"/>
    </State>
  </CombinationRecognizer>
  
  <!-- simple circle anticlockwise with left hand-->
  <CombinationRecognizer name="LeftHandCircleAntiClockwise">
    <State minDuration="0.05" maxDuration="0.2" timeForTransition="0.2">
      <Recognizer name="leftHandMovesLeft"/>
      <NotRecognizer name="leftHandAboveShoulder"/>
    </State>
    <State minDuration="0.05" maxDuration="0.2" timeForTransition="0.2">
      <Recognizer name="leftHandMovesDown"/>
      <NotRecognizer name="leftHandAboveShoulder"/>
    </State>
    <State minDuration="0.05" maxDuration="0.2" timeForTransition="0.2">
      <Recognizer name="leftHandMovesRight"/>
      <NotRecognizer name="leftHandAboveShoulder"/>
    </State>
    <State minDuration="0.05" maxDuration="0.2" timeForTransition="0.2">
      <Recognizer name="leftHandMovesUp"/>
      <NotRecognizer name="leftHandAboveShoulder"/>
    </State>
  </CombinationRecognizer>

  <!-- get left hand orientation when right hand near head-->
  <CombinationRecognizer name="LeftHandOrientation">
    <State minDuration="0.05" maxDuration="0.2" timeForTransition="0.2">
      <Recognizer name="rightHandNearHead"/>
      <Recognizer name ="leftHandAndLeftElbow"/>
    </State>
  </CombinationRecognizer>
  
</FubiRecognizers>